similarity,name,filename,md5,query_filename,query_name,query_md5
0.49784681636419564,"GCF_007844895.1 Shewanella algae strain=JFC2, ASM784489v1",/ceph/db/sourmash/gtdb-rs202.genomic.k31.sbt.zip,c84ac0e8310d571a42f4dd8c06ac7d89,72638.fna.gz,,d2c519d3
0.4815384615384615,"GCF_001598875.1 Shewanella algae JCM 21037 = NBRC 103173 strain=NBRC 103173, ASM159887v1",/ceph/db/sourmash/gtdb-rs202.genomic.k31.sbt.zip,abfeefc64a6c13541cf1099d27962e84,72638.fna.gz,,d2c519d3
0.4591404358353511,"GCF_007595365.1 Shewanella algae strain=CLS2, ASM759536v1",/ceph/db/sourmash/gtdb-rs202.genomic.k31.sbt.zip,ace1848aecdf531df1ef978f5a921d01,72638.fna.gz,,d2c519d3
0.455026455026455,"GCF_007595405.1 Shewanella algae strain=SYT3, ASM759540v1",/ceph/db/sourmash/gtdb-rs202.genomic.k31.sbt.zip,d34cae4323534ab1a2cfbbe7d082a34f,72638.fna.gz,,d2c519d3
0.1638071383844709,"GCF_003217175.1 Shewanella chilikensis strain=JC5, ASM321717v1",/ceph/db/sourmash/gtdb-rs202.genomic.k31.sbt.zip,3ba1ee236792e03ab1a433ead208d38a,72638.fna.gz,,d2c519d3
0.1635678391959799,"GCF_002836945.1 Shewanella chilikensis strain=JC5, ASM283694v1",/ceph/db/sourmash/gtdb-rs202.genomic.k31.sbt.zip,3030bebb74dd5b20c0b1dd0e3167d5d3,72638.fna.gz,,d2c519d3
0.147125,"GCA_014644375.1 Shewanella carassii strain=CGMCC 1.16033, ASM1464437v1",/ceph/db/sourmash/gtdb-rs202.genomic.k31.sbt.zip,21cbe662552585172c50ca586eefbe09,72638.fna.gz,,d2c519d3
0.14703675918979744,"GCF_002777975.1 Shewanella carassii strain=08MAS2251, ASM277797v1",/ceph/db/sourmash/gtdb-rs202.genomic.k31.sbt.zip,b4098bfab5d808a200b300d567512ea1,72638.fna.gz,,d2c519d3
